{
  "$schema": "../schema/orchestrator.schema.json",
  "autoSpawn": true,

  "agent": {
    "enabled": true,
    "name": "orchestrator",
    "model": "anthropic/claude-opus-4-5",
    "mode": "primary"
  },

  "profiles": [
    {
      "id": "vision",
      "name": "Vision Analyst",
      "model": "zhipuai-coding-plan/glm-4.6v",
      "purpose": "Analyze images, screenshots, diagrams, and visual content",
      "whenToUse": "When you need to understand visual content like screenshots, architecture diagrams, UI mockups, or error screenshots",
      "supportsVision": true
    },
    {
      "id": "docs",
      "name": "Documentation Librarian",
      "model": "minimax/MiniMax-M2",
      "purpose": "Research documentation, find examples, explain APIs and libraries",
      "whenToUse": "When you need to look up official documentation, find code examples, understand library APIs, or research best practices",
      "supportsWeb": true,
      "tools": { "write": false, "edit": false }
    },
    {
      "id": "coder",
      "name": "Code Implementer",
      "model": "anthropic/claude-opus-4-5",
      "purpose": "Write, edit, and refactor code with full tool access",
      "whenToUse": "When you need to actually write or modify code, create files, run commands, or implement features"
    },
    {
      "id": "memory",
      "name": "Memory Graph Curator",
      "model": "kimi-for-coding/kimi-k2-thinking",
      "purpose": "Maintain a Neo4j-backed memory graph (project + global) and advise on context pruning",
      "whenToUse": "When you want to record durable project knowledge, track decisions and entities over time, or decide what context can be safely pruned",
      "supportsWeb": true,
      "tags": ["memory", "neo4j", "knowledge-graph", "context-pruning", "summarization"]
    },
    {
      "id": "architect",
      "name": "System Architect",
      "model": "anthropic/claude-opus-4-5",
      "purpose": "Design systems, plan implementations, review architecture decisions",
      "whenToUse": "When you need to plan a complex feature, design system architecture, or make high-level technical decisions",
      "tools": { "write": false, "edit": false, "bash": false }
    },
    {
      "id": "explorer",
      "name": "Code Explorer",
      "model": "zhipuai-coding-plan/glm-4.6",
      "purpose": "Quickly search and navigate the codebase",
      "whenToUse": "When you need to quickly find files, search for patterns, or locate specific code without deep analysis",
      "tools": { "write": false, "edit": false },
      "temperature": 0.1
    }
  ],

  "workers": ["docs"]
}
